{
  "city": "Nashville",
  "city_slug": "nashville",
  "metro": "Middle Tennessee",
  "phone": "(509) 355-7455",
  "phone_raw": "15093557455",
  "review_count": 38,
  "median_price": "$460,000",
  "avg_dom": 35,
  "cash_share": "22%",
  "neighborhoods": "East Nashville, Antioch, Madison, Donelson, and North Nashville",
  "landmark": "the Ryman Auditorium",
  "outlying_area": "Franklin and Murfreesboro",
  "local_market_longform": "<p>Nashville is its own market, and a cash sale here works differently than the national talking points suggest. Homes in Nashville currently trade around a median of $460,000 and take roughly 35 days to go under contract, with about 22% of area sales closing in cash. When you need certainty instead of a drawn-out listing \u2014 a firm number and a date you choose \u2014 that local pace is exactly why selling directly makes sense.</p><p>The housing stock shapes everything about condition here. Nashville runs heavily to 1900s\u20131930s bungalows in East Nashville, post-war ranches, and rapid 2010s\u20132020s infill and tracts, and each era carries its own repair realities. That matters because we price the house in front of us rather than asking you to renovate it first \u2014 the things a traditional buyer's inspector flags are the same things we already expect and account for.</p><p>Local conditions are the other factor a generic buyer ignores. Around Nashville, the issues we see most are expansive-clay and limestone-karst foundation issues, flash-flood risk along the Cumberland, storm roof damage, and older knob-and-tube wiring. We've made offers on homes with every one of those problems, so none of it scares us off or kills the deal at the last minute.</p><p>We buy across the whole area \u2014 from close-in neighborhoods like East Nashville out to Franklin and Murfreesboro \u2014 and in Tennessee the local economy anchored by healthcare-management headquarters, music and entertainment, and fast in-migration keeps demand real. Inherited homes, tired rentals, pre-foreclosure situations in Davidson County, and houses that simply need more work than the owner wants to take on: those are the Nashville sellers we help most.</p><p>Being a genuinely local buyer near the Ryman Auditorium also means our offer isn't a lowball pulled from a national algorithm that has never seen Nashville. We know what a block in East Nashville, Antioch, Madison, and Donelson actually sells for, what Middle Tennessee buyers will and won't pay for, and how Davidson County's title and closing process really works. That local read is why our sellers get a number they can trust and a closing that actually happens on the date we promised.</p>",
  "situations": [
    {
      "title": "Tired of two mortgages",
      "body": "If you've already moved and the old Nashville place is just draining you every month, we can take it off your hands quickly."
    },
    {
      "title": "Relocating",
      "body": "A job change shouldn't mean carrying two mortgages or managing a sale from a thousand miles away. Close on your schedule and move on."
    },
    {
      "title": "Divorce or a major life change",
      "body": "When the goal is simply to have the Nashville house handled cleanly and split fairly, we make the sale the simple part."
    },
    {
      "title": "Downsizing or aging in place",
      "body": "When a longtime East Nashville-area home has become too much to keep up, we make a fair offer and let you set a move-out date that isn't rushed."
    },
    {
      "title": "Inherited a house in Nashville",
      "body": "Settling an estate \u2014 often from out of state \u2014 is hard enough without a listing on top of it. We buy inherited Nashville homes as-is, work alongside the Davidson County probate process, and let you take what matters and leave the rest."
    },
    {
      "title": "Facing foreclosure",
      "body": "If you're behind on payments in Davidson County, a fast cash sale can settle the loan before it hits your credit. We move on your timeline, not the bank's."
    }
  ],
  "testimonials": [
    {
      "quote": "Inherited my mom's place in North Nashville and couldn't face fixing it up. They closed in nine days and I never had to fly back out.",
      "who": "Miguel S., Nashville"
    },
    {
      "quote": "Had a written offer already and they beat it. Straightforward, and the number they promised was the number at closing.",
      "who": "Monica G., Franklin"
    },
    {
      "quote": "Facing foreclosure and out of time. They moved fast, let me pick the date, and I walked away with cash in hand.",
      "who": "Sam J., Nashville"
    }
  ],
  "faq": [
    {
      "q": "How fast can you close on my Nashville house?",
      "a": "As little as 7 days through a licensed Tennessee title company, or any later date you choose. Sellers in Nashville pick the timeline that fits their move."
    },
    {
      "q": "Do I pay any fees or commissions?",
      "a": "None. No agent commissions, no listing fees, and we cover standard closing costs. The number we agree on is what you receive."
    },
    {
      "q": "Do I need to repair or clean the house first?",
      "a": "No. We buy Nashville homes in any condition \u2014 including the expansive-clay and limestone-karst foundation issues we see so often here. Take what you want and leave the rest."
    },
    {
      "q": "How do you decide the offer amount?",
      "a": "We look at recent comparable sales in your Nashville neighborhood \u2014 places like East Nashville \u2014 the home's condition, and current Middle Tennessee demand, then make a fair cash offer you're free to accept or decline."
    },
    {
      "q": "Is this a licensed, legitimate way to sell in Tennessee?",
      "a": "Yes. We are a direct buyer, not your agent or broker, and we put that in writing. Tennessee (SB 909) requires disclosure of intent to assign and the nature of a buyer's interest; our contracts disclose our role plainly."
    },
    {
      "q": "Can you help with foreclosure, probate, or tenants?",
      "a": "Often, yes. We regularly work with Davidson County sellers facing foreclosure, probate, liens, or tenant issues, and we structure the sale around the situation."
    }
  ]
}