{
  "city": "Riverside",
  "city_slug": "riverside",
  "metro": "the Inland Empire",
  "phone": "(509) 355-7455",
  "phone_raw": "15093557455",
  "review_count": 37,
  "median_price": "$610,000",
  "avg_dom": 34,
  "cash_share": "22%",
  "neighborhoods": "the Wood Streets, Casa Blanca, La Sierra, Arlington, and Eastside",
  "landmark": "the Mission Inn",
  "outlying_area": "Moreno Valley and Corona",
  "local_market_longform": "<p>Riverside is its own market, and a cash sale here works differently than the national talking points suggest. Homes in Riverside currently trade around a median of $610,000 and take roughly 34 days to go under contract, with about 22% of area sales closing in cash. When you need certainty instead of a drawn-out listing \u2014 a firm number and a date you choose \u2014 that local pace is exactly why selling directly makes sense.</p><p>The housing stock shapes everything about condition here. Riverside runs heavily to 1910s\u20131920s bungalows near downtown and vast 1980s\u20132000s master-planned tracts, and each era carries its own repair realities. That matters because we price the house in front of us rather than asking you to renovate it first \u2014 the things a traditional buyer's inspector flags are the same things we already expect and account for.</p><p>Local conditions are the other factor a generic buyer ignores. Around Riverside, the issues we see most are wildfire and Santa Ana wind exposure, extreme-heat HVAC and roof wear, and expansive-soil foundation cracking. We've made offers on homes with every one of those problems, so none of it scares us off or kills the deal at the last minute.</p><p>We buy across the whole area \u2014 from close-in neighborhoods like the Wood Streets out to Moreno Valley and Corona \u2014 and in California the local economy anchored by logistics and warehousing along the I-215/I-10 corridor, healthcare, and LA-overflow commuters keeps demand real. Inherited homes, tired rentals, pre-foreclosure situations in Riverside County, and houses that simply need more work than the owner wants to take on: those are the Riverside sellers we help most.</p><p>Being a genuinely local buyer near the Mission Inn also means our offer isn't a lowball pulled from a national algorithm that has never seen Riverside. We know what a block in the Wood Streets, Casa Blanca, La Sierra, and Arlington actually sells for, what the Inland Empire buyers will and won't pay for, and how Riverside County's title and closing process really works. That local read is why our sellers get a number they can trust and a closing that actually happens on the date we promised.</p>",
  "situations": [
    {
      "title": "Relocating",
      "body": "A job change shouldn't mean carrying two mortgages or managing a sale from a thousand miles away. Close on your schedule and move on."
    },
    {
      "title": "Downsizing or aging in place",
      "body": "When a longtime the Wood Streets-area home has become too much to keep up, we make a fair offer and let you set a move-out date that isn't rushed."
    },
    {
      "title": "Tired of two mortgages",
      "body": "If you've already moved and the old Riverside place is just draining you every month, we can take it off your hands quickly."
    },
    {
      "title": "Divorce or a major life change",
      "body": "When the goal is simply to have the Riverside house handled cleanly and split fairly, we make the sale the simple part."
    },
    {
      "title": "Facing foreclosure",
      "body": "If you're behind on payments in Riverside County, a fast cash sale can settle the loan before it hits your credit. We move on your timeline, not the bank's."
    },
    {
      "title": "The house needs too much work",
      "body": "Fire, water, foundation, or years of deferred repairs \u2014 we've bought all of it around Riverside. No cleaning, no contractors, no staging."
    }
  ],
  "testimonials": [
    {
      "quote": "Inherited my mom's place in Casa Blanca and couldn't face fixing it up. They closed in nine days and I never had to fly back out.",
      "who": "Omar C., Riverside"
    },
    {
      "quote": "Had a written offer already and they beat it. Straightforward, and the number they promised was the number at closing.",
      "who": "Angela M., Moreno Valley"
    },
    {
      "quote": "Facing foreclosure and out of time. They moved fast, let me pick the date, and I walked away with cash in hand.",
      "who": "Tanya D., Riverside"
    }
  ],
  "faq": [
    {
      "q": "How fast can you close on my Riverside house?",
      "a": "As little as 7 days through a licensed California title company, or any later date you choose. Sellers in Riverside pick the timeline that fits their move."
    },
    {
      "q": "Do I pay any fees or commissions?",
      "a": "None. No agent commissions, no listing fees, and we cover standard closing costs. The number we agree on is what you receive."
    },
    {
      "q": "Do I need to repair or clean the house first?",
      "a": "No. We buy Riverside homes in any condition \u2014 including the wildfire and Santa Ana wind exposure we see so often here. Take what you want and leave the rest."
    },
    {
      "q": "How do you decide the offer amount?",
      "a": "We look at recent comparable sales in your Riverside neighborhood \u2014 places like the Wood Streets \u2014 the home's condition, and current the Inland Empire demand, then make a fair cash offer you're free to accept or decline."
    },
    {
      "q": "Is this a licensed, legitimate way to sell in California?",
      "a": "Yes. We are a direct buyer, not your agent or broker, and we put that in writing. California permits direct cash purchases; we market our own equitable interest and disclose our role in writing."
    },
    {
      "q": "Can you help with foreclosure, probate, or tenants?",
      "a": "Often, yes. We regularly work with Riverside County sellers facing foreclosure, probate, liens, or tenant issues, and we structure the sale around the situation."
    }
  ]
}