{
  "city": "Vancouver",
  "city_slug": "vancouver",
  "metro": "Southwest Washington",
  "phone": "(509) 355-7455",
  "phone_raw": "15093557455",
  "review_count": 41,
  "median_price": "$525,000",
  "avg_dom": 26,
  "cash_share": "20%",
  "neighborhoods": "Hough, Uptown Village, Cascade Park, Felida, and Fisher's Landing",
  "landmark": "the Fort Vancouver waterfront",
  "outlying_area": "Camas and Battle Ground",
  "local_market_longform": "<p>Vancouver is its own market, and a cash sale here works differently than the national talking points suggest. Homes in Vancouver currently trade around a median of $525,000 and take roughly 26 days to go under contract, with about 20% of area sales closing in cash. When you need certainty instead of a drawn-out listing \u2014 a firm number and a date you choose \u2014 that local pace is exactly why selling directly makes sense.</p><p>The housing stock shapes everything about condition here. Vancouver runs heavily to pre-war cottages near downtown and heavy 1990s\u20132010s suburban tract housing east and north, and each era carries its own repair realities. That matters because we price the house in front of us rather than asking you to renovate it first \u2014 the things a traditional buyer's inspector flags are the same things we already expect and account for.</p><p>Local conditions are the other factor a generic buyer ignores. Around Vancouver, the issues we see most are damp-climate roof moss and gutter failures, crawl-space moisture and mold, and aging septic systems in outlying areas. We've made offers on homes with every one of those problems, so none of it scares us off or kills the deal at the last minute.</p><p>We buy across the whole area \u2014 from close-in neighborhoods like Hough out to Camas and Battle Ground \u2014 and in Washington the local economy anchored by no state income tax pulling Portland commuters across the river, plus tech and healthcare growth keeps demand real. Inherited homes, tired rentals, pre-foreclosure situations in Clark County, and houses that simply need more work than the owner wants to take on: those are the Vancouver sellers we help most.</p><p>Being a genuinely local buyer near the Fort Vancouver waterfront also means our offer isn't a lowball pulled from a national algorithm that has never seen Vancouver. We know what a block in Hough, Uptown Village, Cascade Park, and Felida actually sells for, what Southwest Washington buyers will and won't pay for, and how Clark County's title and closing process really works. That local read is why our sellers get a number they can trust and a closing that actually happens on the date we promised.</p>",
  "situations": [
    {
      "title": "Tired of two mortgages",
      "body": "If you've already moved and the old Vancouver place is just draining you every month, we can take it off your hands quickly."
    },
    {
      "title": "Downsizing or aging in place",
      "body": "When a longtime Hough-area home has become too much to keep up, we make a fair offer and let you set a move-out date that isn't rushed."
    },
    {
      "title": "Relocating",
      "body": "A job change shouldn't mean carrying two mortgages or managing a sale from a thousand miles away. Close on your schedule and move on."
    },
    {
      "title": "Facing foreclosure",
      "body": "If you're behind on payments in Clark County, a fast cash sale can settle the loan before it hits your credit. We move on your timeline, not the bank's."
    },
    {
      "title": "Divorce or a major life change",
      "body": "When the goal is simply to have the Vancouver house handled cleanly and split fairly, we make the sale the simple part."
    },
    {
      "title": "Inherited a house in Vancouver",
      "body": "Settling an estate \u2014 often from out of state \u2014 is hard enough without a listing on top of it. We buy inherited Vancouver homes as-is, work alongside the Clark County probate process, and let you take what matters and leave the rest."
    }
  ],
  "testimonials": [
    {
      "quote": "Inherited my mom's place in Fisher's Landing and couldn't face fixing it up. They closed in nine days and I never had to fly back out.",
      "who": "Karen R., Vancouver"
    },
    {
      "quote": "Had a written offer already and they beat it. Straightforward, and the number they promised was the number at closing.",
      "who": "Priya G., Battle Ground"
    },
    {
      "quote": "Facing foreclosure and out of time. They moved fast, let me pick the date, and I walked away with cash in hand.",
      "who": "Monica S., Vancouver"
    }
  ],
  "faq": [
    {
      "q": "How fast can you close on my Vancouver house?",
      "a": "As little as 7 days through a licensed Washington title company, or any later date you choose. Sellers in Vancouver pick the timeline that fits their move."
    },
    {
      "q": "Do I pay any fees or commissions?",
      "a": "None. No agent commissions, no listing fees, and we cover standard closing costs. The number we agree on is what you receive."
    },
    {
      "q": "Do I need to repair or clean the house first?",
      "a": "No. We buy Vancouver homes in any condition \u2014 including the damp-climate roof moss and gutter failures we see so often here. Take what you want and leave the rest."
    },
    {
      "q": "How do you decide the offer amount?",
      "a": "We look at recent comparable sales in your Vancouver neighborhood \u2014 places like Hough \u2014 the home's condition, and current Southwest Washington demand, then make a fair cash offer you're free to accept or decline."
    },
    {
      "q": "Is this a licensed, legitimate way to sell in Washington?",
      "a": "Yes. We are a direct buyer, not your agent or broker, and we put that in writing. Washington has no wholesaling-specific statute; we operate as a direct buyer and disclose our interest in writing."
    },
    {
      "q": "Can you help with foreclosure, probate, or tenants?",
      "a": "Often, yes. We regularly work with Clark County sellers facing foreclosure, probate, liens, or tenant issues, and we structure the sale around the situation."
    }
  ]
}