{
  "city": "San Diego",
  "city_slug": "san-diego",
  "metro": "San Diego County",
  "phone": "(509) 355-7455",
  "phone_raw": "15093557455",
  "review_count": 52,
  "median_price": "$925,000",
  "avg_dom": 39,
  "cash_share": "23%",
  "neighborhoods": "City Heights, Barrio Logan, Clairemont, Encanto, and North Park",
  "landmark": "Balboa Park",
  "outlying_area": "Chula Vista and El Cajon",
  "local_market_longform": "<p>San Diego is its own market, and a cash sale here works differently than the national talking points suggest. Homes in San Diego currently trade around a median of $925,000 and take roughly 39 days to go under contract, with about 23% of area sales closing in cash. When you need certainty instead of a drawn-out listing \u2014 a firm number and a date you choose \u2014 that local pace is exactly why selling directly makes sense.</p><p>The housing stock shapes everything about condition here. San Diego runs heavily to 1920s Spanish bungalows, post-war ranches in the mesas, and 1980s\u20132000s canyon-rim tracts, and each era carries its own repair realities. That matters because we price the house in front of us rather than asking you to renovate it first \u2014 the things a traditional buyer's inspector flags are the same things we already expect and account for.</p><p>Local conditions are the other factor a generic buyer ignores. Around San Diego, the issues we see most are canyon-slope drainage and slide risk, wildfire exposure in the eastern suburbs, aging cast-iron sewer laterals, and clay-soil foundation movement. We've made offers on homes with every one of those problems, so none of it scares us off or kills the deal at the last minute.</p><p>We buy across the whole area \u2014 from close-in neighborhoods like City Heights out to Chula Vista and El Cajon \u2014 and in California the local economy anchored by the U.S. Navy and Marines, biotech, defense contractors, and cross-border trade keeps demand real. Inherited homes, tired rentals, pre-foreclosure situations in San Diego County, and houses that simply need more work than the owner wants to take on: those are the San Diego sellers we help most.</p><p>Being a genuinely local buyer near Balboa Park also means our offer isn't a lowball pulled from a national algorithm that has never seen San Diego. We know what a block in City Heights, Barrio Logan, Clairemont, and Encanto actually sells for, what San Diego County buyers will and won't pay for, and how San Diego County's title and closing process really works. That local read is why our sellers get a number they can trust and a closing that actually happens on the date we promised.</p>",
  "situations": [
    {
      "title": "Inherited a house in San Diego",
      "body": "Settling an estate \u2014 often from out of state \u2014 is hard enough without a listing on top of it. We buy inherited San Diego homes as-is, work alongside the San Diego County probate process, and let you take what matters and leave the rest."
    },
    {
      "title": "Downsizing or aging in place",
      "body": "When a longtime City Heights-area home has become too much to keep up, we make a fair offer and let you set a move-out date that isn't rushed."
    },
    {
      "title": "Divorce or a major life change",
      "body": "When the goal is simply to have the San Diego house handled cleanly and split fairly, we make the sale the simple part."
    },
    {
      "title": "Relocating",
      "body": "A job change shouldn't mean carrying two mortgages or managing a sale from a thousand miles away. Close on your schedule and move on."
    },
    {
      "title": "Done being a landlord",
      "body": "Problem tenants, deferred maintenance, or a San Diego rental that stopped penciling out. We buy occupied properties and handle the situation so you can walk away clean."
    },
    {
      "title": "The house needs too much work",
      "body": "Fire, water, foundation, or years of deferred repairs \u2014 we've bought all of it around San Diego. No cleaning, no contractors, no staging."
    }
  ],
  "testimonials": [
    {
      "quote": "Inherited my mom's place in North Park and couldn't face fixing it up. They closed in nine days and I never had to fly back out.",
      "who": "Tanya J., San Diego"
    },
    {
      "quote": "Had a written offer already and they beat it. Straightforward, and the number they promised was the number at closing.",
      "who": "Marcus P., Chula Vista"
    },
    {
      "quote": "Facing foreclosure and out of time. They moved fast, let me pick the date, and I walked away with cash in hand.",
      "who": "Nicole H., San Diego"
    }
  ],
  "faq": [
    {
      "q": "How fast can you close on my San Diego house?",
      "a": "As little as 7 days through a licensed California title company, or any later date you choose. Sellers in San Diego pick the timeline that fits their move."
    },
    {
      "q": "Do I pay any fees or commissions?",
      "a": "None. No agent commissions, no listing fees, and we cover standard closing costs. The number we agree on is what you receive."
    },
    {
      "q": "Do I need to repair or clean the house first?",
      "a": "No. We buy San Diego homes in any condition \u2014 including the canyon-slope drainage and slide risk we see so often here. Take what you want and leave the rest."
    },
    {
      "q": "How do you decide the offer amount?",
      "a": "We look at recent comparable sales in your San Diego neighborhood \u2014 places like City Heights \u2014 the home's condition, and current San Diego County demand, then make a fair cash offer you're free to accept or decline."
    },
    {
      "q": "Is this a licensed, legitimate way to sell in California?",
      "a": "Yes. We are a direct buyer, not your agent or broker, and we put that in writing. California permits direct cash purchases; we market our own equitable interest and disclose our role in writing."
    },
    {
      "q": "Can you help with foreclosure, probate, or tenants?",
      "a": "Often, yes. We regularly work with San Diego County sellers facing foreclosure, probate, liens, or tenant issues, and we structure the sale around the situation."
    }
  ]
}