{
  "city": "Albany",
  "city_slug": "albany",
  "metro": "the Capital Region",
  "phone": "(509) 355-7455",
  "phone_raw": "15093557455",
  "review_count": 28,
  "median_price": "$280,000",
  "avg_dom": 23,
  "cash_share": "24%",
  "neighborhoods": "the South End, Arbor Hill, Pine Hills, West Hill, and Delaware Avenue",
  "landmark": "the New York State Capitol",
  "outlying_area": "Schenectady and Troy",
  "local_market_longform": "<p>Albany is its own market, and a cash sale here works differently than the national talking points suggest. Homes in Albany currently trade around a median of $280,000 and take roughly 23 days to go under contract, with about 24% of area sales closing in cash. When you need certainty instead of a drawn-out listing \u2014 a firm number and a date you choose \u2014 that local pace is exactly why selling directly makes sense.</p><p>The housing stock shapes everything about condition here. Albany runs heavily to late-1800s to 1920s brownstones, rowhomes, and Victorians, plus post-war suburban ranches, and each era carries its own repair realities. That matters because we price the house in front of us rather than asking you to renovate it first \u2014 the things a traditional buyer's inspector flags are the same things we already expect and account for.</p><p>Local conditions are the other factor a generic buyer ignores. Around Albany, the issues we see most are aging rowhome plumbing and knob-and-tube wiring, freeze-thaw and ice-dam roof damage, flat-roof failures, and basement moisture. We've made offers on homes with every one of those problems, so none of it scares us off or kills the deal at the last minute.</p><p>We buy across the whole area \u2014 from close-in neighborhoods like the South End out to Schenectady and Troy \u2014 and in New York the local economy anchored by state government, healthcare, and the growing semiconductor corridor (Tech Valley) keeps demand real. Inherited homes, tired rentals, pre-foreclosure situations in Albany County, and houses that simply need more work than the owner wants to take on: those are the Albany sellers we help most.</p><p>Being a genuinely local buyer near the New York State Capitol also means our offer isn't a lowball pulled from a national algorithm that has never seen Albany. We know what a block in the South End, Arbor Hill, Pine Hills, and West Hill actually sells for, what the Capital Region buyers will and won't pay for, and how Albany County's title and closing process really works. That local read is why our sellers get a number they can trust and a closing that actually happens on the date we promised.</p>",
  "situations": [
    {
      "title": "The house needs too much work",
      "body": "Fire, water, foundation, or years of deferred repairs \u2014 we've bought all of it around Albany. No cleaning, no contractors, no staging."
    },
    {
      "title": "Tired of two mortgages",
      "body": "If you've already moved and the old Albany place is just draining you every month, we can take it off your hands quickly."
    },
    {
      "title": "Divorce or a major life change",
      "body": "When the goal is simply to have the Albany house handled cleanly and split fairly, we make the sale the simple part."
    },
    {
      "title": "Done being a landlord",
      "body": "Problem tenants, deferred maintenance, or a Albany rental that stopped penciling out. We buy occupied properties and handle the situation so you can walk away clean."
    },
    {
      "title": "Relocating",
      "body": "A job change shouldn't mean carrying two mortgages or managing a sale from a thousand miles away. Close on your schedule and move on."
    },
    {
      "title": "Facing foreclosure",
      "body": "If you're behind on payments in Albany County, a fast cash sale can settle the loan before it hits your credit. We move on your timeline, not the bank's."
    }
  ],
  "testimonials": [
    {
      "quote": "Inherited my mom's place in Delaware Avenue and couldn't face fixing it up. They closed in nine days and I never had to fly back out.",
      "who": "Danielle F., Albany"
    },
    {
      "quote": "Had a written offer already and they beat it. Straightforward, and the number they promised was the number at closing.",
      "who": "Sam J., Schenectady"
    },
    {
      "quote": "Facing foreclosure and out of time. They moved fast, let me pick the date, and I walked away with cash in hand.",
      "who": "Grace H., Albany"
    }
  ],
  "faq": [
    {
      "q": "How fast can you close on my Albany house?",
      "a": "As little as 7 days through a licensed New York title company, or any later date you choose. Sellers in Albany pick the timeline that fits their move."
    },
    {
      "q": "Do I pay any fees or commissions?",
      "a": "None. No agent commissions, no listing fees, and we cover standard closing costs. The number we agree on is what you receive."
    },
    {
      "q": "Do I need to repair or clean the house first?",
      "a": "No. We buy Albany homes in any condition \u2014 including the aging rowhome plumbing and knob-and-tube wiring we see so often here. Take what you want and leave the rest."
    },
    {
      "q": "How do you decide the offer amount?",
      "a": "We look at recent comparable sales in your Albany neighborhood \u2014 places like the South End \u2014 the home's condition, and current the Capital Region demand, then make a fair cash offer you're free to accept or decline."
    },
    {
      "q": "Is this a licensed, legitimate way to sell in New York?",
      "a": "Yes. We are a direct buyer, not your agent or broker, and we put that in writing. New York permits direct purchases; we market our own equitable interest to a private buyer network and disclose our role in writing."
    },
    {
      "q": "Can you help with foreclosure, probate, or tenants?",
      "a": "Often, yes. We regularly work with Albany County sellers facing foreclosure, probate, liens, or tenant issues, and we structure the sale around the situation."
    }
  ]
}