{
  "city": "Denver",
  "city_slug": "denver",
  "metro": "the Front Range",
  "phone": "(509) 355-7455",
  "phone_raw": "15093557455",
  "review_count": 42,
  "median_price": "$580,000",
  "avg_dom": 26,
  "cash_share": "21%",
  "neighborhoods": "Montbello, Globeville, Barnum, Park Hill, and Berkeley",
  "landmark": "the Rocky Mountain skyline",
  "outlying_area": "Aurora and Lakewood",
  "local_market_longform": "<p>Denver is its own market, and a cash sale here works differently than the national talking points suggest. Homes in Denver currently trade around a median of $580,000 and take roughly 26 days to go under contract, with about 21% of area sales closing in cash. When you need certainty instead of a drawn-out listing \u2014 a firm number and a date you choose \u2014 that local pace is exactly why selling directly makes sense.</p><p>The housing stock shapes everything about condition here. Denver runs heavily to 1900s\u20131920s brick bungalows and Denver Squares, post-war ranches, and 1990s+ suburban tracts, and each era carries its own repair realities. That matters because we price the house in front of us rather than asking you to renovate it first \u2014 the things a traditional buyer's inspector flags are the same things we already expect and account for.</p><p>Local conditions are the other factor a generic buyer ignores. Around Denver, the issues we see most are expansive bentonite clay soils that heave slabs and foundations, hail-damaged roofs, and aging swamp coolers and boilers. We've made offers on homes with every one of those problems, so none of it scares us off or kills the deal at the last minute.</p><p>We buy across the whole area \u2014 from close-in neighborhoods like Montbello out to Aurora and Lakewood \u2014 and in Colorado the local economy anchored by aerospace and defense, energy, tech in-migration, and a deep healthcare base keeps demand real. Inherited homes, tired rentals, pre-foreclosure situations in Denver County, and houses that simply need more work than the owner wants to take on: those are the Denver sellers we help most.</p><p>Being a genuinely local buyer near the Rocky Mountain skyline also means our offer isn't a lowball pulled from a national algorithm that has never seen Denver. We know what a block in Montbello, Globeville, Barnum, and Park Hill actually sells for, what the Front Range buyers will and won't pay for, and how Denver County's title and closing process really works. That local read is why our sellers get a number they can trust and a closing that actually happens on the date we promised.</p>",
  "situations": [
    {
      "title": "Divorce or a major life change",
      "body": "When the goal is simply to have the Denver house handled cleanly and split fairly, we make the sale the simple part."
    },
    {
      "title": "Facing foreclosure",
      "body": "If you're behind on payments in Denver County, a fast cash sale can settle the loan before it hits your credit. We move on your timeline, not the bank's."
    },
    {
      "title": "Done being a landlord",
      "body": "Problem tenants, deferred maintenance, or a Denver rental that stopped penciling out. We buy occupied properties and handle the situation so you can walk away clean."
    },
    {
      "title": "The house needs too much work",
      "body": "Fire, water, foundation, or years of deferred repairs \u2014 we've bought all of it around Denver. No cleaning, no contractors, no staging."
    },
    {
      "title": "Relocating",
      "body": "A job change shouldn't mean carrying two mortgages or managing a sale from a thousand miles away. Close on your schedule and move on."
    },
    {
      "title": "Inherited a house in Denver",
      "body": "Settling an estate \u2014 often from out of state \u2014 is hard enough without a listing on top of it. We buy inherited Denver homes as-is, work alongside the Denver County probate process, and let you take what matters and leave the rest."
    }
  ],
  "testimonials": [
    {
      "quote": "Inherited my mom's place in Park Hill and couldn't face fixing it up. They closed in nine days and I never had to fly back out.",
      "who": "Marcus T., Denver"
    },
    {
      "quote": "Had a written offer already and they beat it. Straightforward, and the number they promised was the number at closing.",
      "who": "Yolanda L., Lakewood"
    },
    {
      "quote": "Facing foreclosure and out of time. They moved fast, let me pick the date, and I walked away with cash in hand.",
      "who": "Karen D., Denver"
    }
  ],
  "faq": [
    {
      "q": "How fast can you close on my Denver house?",
      "a": "As little as 7 days through a licensed Colorado title company, or any later date you choose. Sellers in Denver pick the timeline that fits their move."
    },
    {
      "q": "Do I pay any fees or commissions?",
      "a": "None. No agent commissions, no listing fees, and we cover standard closing costs. The number we agree on is what you receive."
    },
    {
      "q": "Do I need to repair or clean the house first?",
      "a": "No. We buy Denver homes in any condition \u2014 including the expansive bentonite clay soils that heave slabs and foundations we see so often here. Take what you want and leave the rest."
    },
    {
      "q": "How do you decide the offer amount?",
      "a": "We look at recent comparable sales in your Denver neighborhood \u2014 places like Montbello \u2014 the home's condition, and current the Front Range demand, then make a fair cash offer you're free to accept or decline."
    },
    {
      "q": "Is this a licensed, legitimate way to sell in Colorado?",
      "a": "Yes. We are a direct buyer, not your agent or broker, and we put that in writing. Colorado permits direct cash purchases; we disclose our role as a principal buyer on every contract."
    },
    {
      "q": "Can you help with foreclosure, probate, or tenants?",
      "a": "Often, yes. We regularly work with Denver County sellers facing foreclosure, probate, liens, or tenant issues, and we structure the sale around the situation."
    }
  ]
}