{
  "city": "Reno",
  "city_slug": "reno",
  "metro": "the Truckee Meadows",
  "phone": "(509) 355-7455",
  "phone_raw": "15093557455",
  "review_count": 33,
  "median_price": "$560,000",
  "avg_dom": 38,
  "cash_share": "24%",
  "neighborhoods": "Midtown, the Wells Avenue district, Northwest Reno, Sun Valley, and Old Southwest",
  "landmark": "the Reno Arch",
  "outlying_area": "Sparks and Carson City",
  "local_market_longform": "<p>Reno is its own market, and a cash sale here works differently than the national talking points suggest. Homes in Reno currently trade around a median of $560,000 and take roughly 38 days to go under contract, with about 24% of area sales closing in cash. When you need certainty instead of a drawn-out listing \u2014 a firm number and a date you choose \u2014 that local pace is exactly why selling directly makes sense.</p><p>The housing stock shapes everything about condition here. Reno runs heavily to early-1900s cottages in the older core and heavy 1990s\u20132010s tract and master-planned growth south and north, and each era carries its own repair realities. That matters because we price the house in front of us rather than asking you to renovate it first \u2014 the things a traditional buyer's inspector flags are the same things we already expect and account for.</p><p>Local conditions are the other factor a generic buyer ignores. Around Reno, the issues we see most are high-desert freeze-thaw cracking, wildfire exposure in the foothills, seismic risk on regional faults, and aging swamp coolers. We've made offers on homes with every one of those problems, so none of it scares us off or kills the deal at the last minute.</p><p>We buy across the whole area \u2014 from close-in neighborhoods like Midtown out to Sparks and Carson City \u2014 and in Nevada the local economy anchored by Tesla's Gigafactory and the Tahoe-Reno Industrial Center, logistics, and California out-migration keeps demand real. Inherited homes, tired rentals, pre-foreclosure situations in Washoe County, and houses that simply need more work than the owner wants to take on: those are the Reno sellers we help most.</p><p>Being a genuinely local buyer near the Reno Arch also means our offer isn't a lowball pulled from a national algorithm that has never seen Reno. We know what a block in Midtown, the Wells Avenue district, Northwest Reno, and Sun Valley actually sells for, what the Truckee Meadows buyers will and won't pay for, and how Washoe County's title and closing process really works. That local read is why our sellers get a number they can trust and a closing that actually happens on the date we promised.</p>",
  "situations": [
    {
      "title": "Tired of two mortgages",
      "body": "If you've already moved and the old Reno place is just draining you every month, we can take it off your hands quickly."
    },
    {
      "title": "Done being a landlord",
      "body": "Problem tenants, deferred maintenance, or a Reno rental that stopped penciling out. We buy occupied properties and handle the situation so you can walk away clean."
    },
    {
      "title": "Downsizing or aging in place",
      "body": "When a longtime Midtown-area home has become too much to keep up, we make a fair offer and let you set a move-out date that isn't rushed."
    },
    {
      "title": "Divorce or a major life change",
      "body": "When the goal is simply to have the Reno house handled cleanly and split fairly, we make the sale the simple part."
    },
    {
      "title": "Inherited a house in Reno",
      "body": "Settling an estate \u2014 often from out of state \u2014 is hard enough without a listing on top of it. We buy inherited Reno homes as-is, work alongside the Washoe County probate process, and let you take what matters and leave the rest."
    },
    {
      "title": "The house needs too much work",
      "body": "Fire, water, foundation, or years of deferred repairs \u2014 we've bought all of it around Reno. No cleaning, no contractors, no staging."
    }
  ],
  "testimonials": [
    {
      "quote": "Inherited my mom's place in Midtown and couldn't face fixing it up. They closed in nine days and I never had to fly back out.",
      "who": "Lisa G., Reno"
    },
    {
      "quote": "Had a written offer already and they beat it. Straightforward, and the number they promised was the number at closing.",
      "who": "Omar H., Carson City"
    },
    {
      "quote": "Facing foreclosure and out of time. They moved fast, let me pick the date, and I walked away with cash in hand.",
      "who": "Sandra M., Reno"
    }
  ],
  "faq": [
    {
      "q": "How fast can you close on my Reno house?",
      "a": "As little as 7 days through a licensed Nevada title company, or any later date you choose. Sellers in Reno pick the timeline that fits their move."
    },
    {
      "q": "Do I pay any fees or commissions?",
      "a": "None. No agent commissions, no listing fees, and we cover standard closing costs. The number we agree on is what you receive."
    },
    {
      "q": "Do I need to repair or clean the house first?",
      "a": "No. We buy Reno homes in any condition \u2014 including the high-desert freeze-thaw cracking we see so often here. Take what you want and leave the rest."
    },
    {
      "q": "How do you decide the offer amount?",
      "a": "We look at recent comparable sales in your Reno neighborhood \u2014 places like Midtown \u2014 the home's condition, and current the Truckee Meadows demand, then make a fair cash offer you're free to accept or decline."
    },
    {
      "q": "Is this a licensed, legitimate way to sell in Nevada?",
      "a": "Yes. We are a direct buyer, not your agent or broker, and we put that in writing. Nevada permits direct purchases when acting on your own behalf; we buy as a principal, not as your agent."
    },
    {
      "q": "Can you help with foreclosure, probate, or tenants?",
      "a": "Often, yes. We regularly work with Washoe County sellers facing foreclosure, probate, liens, or tenant issues, and we structure the sale around the situation."
    }
  ]
}