{
  "city": "Kansas City",
  "city_slug": "kansas-city",
  "metro": "the Kansas City metro",
  "phone": "(509) 355-7455",
  "phone_raw": "15093557455",
  "review_count": 39,
  "median_price": "$285,000",
  "avg_dom": 28,
  "cash_share": "23%",
  "neighborhoods": "the East Side, Waldo, Ivanhoe, Brookside, and the Historic Northeast",
  "landmark": "the Country Club Plaza",
  "outlying_area": "Independence and Lee's Summit",
  "local_market_longform": "<p>Kansas City is its own market, and a cash sale here works differently than the national talking points suggest. Homes in Kansas City currently trade around a median of $285,000 and take roughly 28 days to go under contract, with about 23% of area sales closing in cash. When you need certainty instead of a drawn-out listing \u2014 a firm number and a date you choose \u2014 that local pace is exactly why selling directly makes sense.</p><p>The housing stock shapes everything about condition here. Kansas City runs heavily to 1900s\u20131920s bungalows and shirtwaists, post-war ranches, and newer suburban tracts, and each era carries its own repair realities. That matters because we price the house in front of us rather than asking you to renovate it first \u2014 the things a traditional buyer's inspector flags are the same things we already expect and account for.</p><p>Local conditions are the other factor a generic buyer ignores. Around Kansas City, the issues we see most are expansive-clay foundation heave, tornado and hail damage, aging cast-iron and clay sewer laterals, and older knob-and-tube wiring. We've made offers on homes with every one of those problems, so none of it scares us off or kills the deal at the last minute.</p><p>We buy across the whole area \u2014 from close-in neighborhoods like the East Side out to Independence and Lee's Summit \u2014 and in Missouri the local economy anchored by logistics and distribution, healthcare and animal-health, finance, and a growing tech scene keeps demand real. Inherited homes, tired rentals, pre-foreclosure situations in Jackson County, and houses that simply need more work than the owner wants to take on: those are the Kansas City sellers we help most.</p><p>Being a genuinely local buyer near the Country Club Plaza also means our offer isn't a lowball pulled from a national algorithm that has never seen Kansas City. We know what a block in the East Side, Waldo, Ivanhoe, and Brookside actually sells for, what the Kansas City metro buyers will and won't pay for, and how Jackson County's title and closing process really works. That local read is why our sellers get a number they can trust and a closing that actually happens on the date we promised.</p>",
  "situations": [
    {
      "title": "Downsizing or aging in place",
      "body": "When a longtime the East Side-area home has become too much to keep up, we make a fair offer and let you set a move-out date that isn't rushed."
    },
    {
      "title": "Divorce or a major life change",
      "body": "When the goal is simply to have the Kansas City house handled cleanly and split fairly, we make the sale the simple part."
    },
    {
      "title": "Done being a landlord",
      "body": "Problem tenants, deferred maintenance, or a Kansas City rental that stopped penciling out. We buy occupied properties and handle the situation so you can walk away clean."
    },
    {
      "title": "Relocating",
      "body": "A job change shouldn't mean carrying two mortgages or managing a sale from a thousand miles away. Close on your schedule and move on."
    },
    {
      "title": "The house needs too much work",
      "body": "Fire, water, foundation, or years of deferred repairs \u2014 we've bought all of it around Kansas City. No cleaning, no contractors, no staging."
    },
    {
      "title": "Tired of two mortgages",
      "body": "If you've already moved and the old Kansas City place is just draining you every month, we can take it off your hands quickly."
    }
  ],
  "testimonials": [
    {
      "quote": "Inherited my mom's place in Waldo and couldn't face fixing it up. They closed in nine days and I never had to fly back out.",
      "who": "Paul J., Kansas City"
    },
    {
      "quote": "Had a written offer already and they beat it. Straightforward, and the number they promised was the number at closing.",
      "who": "Tanya S., Independence"
    },
    {
      "quote": "Facing foreclosure and out of time. They moved fast, let me pick the date, and I walked away with cash in hand.",
      "who": "Grace G., Kansas City"
    }
  ],
  "faq": [
    {
      "q": "How fast can you close on my Kansas City house?",
      "a": "As little as 7 days through a licensed Missouri title company, or any later date you choose. Sellers in Kansas City pick the timeline that fits their move."
    },
    {
      "q": "Do I pay any fees or commissions?",
      "a": "None. No agent commissions, no listing fees, and we cover standard closing costs. The number we agree on is what you receive."
    },
    {
      "q": "Do I need to repair or clean the house first?",
      "a": "No. We buy Kansas City homes in any condition \u2014 including the expansive-clay foundation heave we see so often here. Take what you want and leave the rest."
    },
    {
      "q": "How do you decide the offer amount?",
      "a": "We look at recent comparable sales in your Kansas City neighborhood \u2014 places like the East Side \u2014 the home's condition, and current the Kansas City metro demand, then make a fair cash offer you're free to accept or decline."
    },
    {
      "q": "Is this a licensed, legitimate way to sell in Missouri?",
      "a": "Yes. We are a direct buyer, not your agent or broker, and we put that in writing. Missouri has no wholesaling-specific statute; we buy directly and disclose our interest in writing."
    },
    {
      "q": "Can you help with foreclosure, probate, or tenants?",
      "a": "Often, yes. We regularly work with Jackson County sellers facing foreclosure, probate, liens, or tenant issues, and we structure the sale around the situation."
    }
  ]
}