{
  "city": "Las Vegas",
  "city_slug": "las-vegas",
  "metro": "the Las Vegas Valley",
  "phone": "(509) 355-7455",
  "phone_raw": "15093557455",
  "review_count": 45,
  "median_price": "$465,000",
  "avg_dom": 42,
  "cash_share": "27%",
  "neighborhoods": "the Historic Westside, east Las Vegas, Spring Valley, Sunrise Manor, and Summerlin's edges",
  "landmark": "the Strip",
  "outlying_area": "Henderson and North Las Vegas",
  "local_market_longform": "<p>Las Vegas is its own market, and a cash sale here works differently than the national talking points suggest. Homes in Las Vegas currently trade around a median of $465,000 and take roughly 42 days to go under contract, with about 27% of area sales closing in cash. When you need certainty instead of a drawn-out listing \u2014 a firm number and a date you choose \u2014 that local pace is exactly why selling directly makes sense.</p><p>The housing stock shapes everything about condition here. Las Vegas runs heavily to post-war ranches near downtown and an enormous share of 1990s\u20132000s stucco tract housing, and each era carries its own repair realities. That matters because we price the house in front of us rather than asking you to renovate it first \u2014 the things a traditional buyer's inspector flags are the same things we already expect and account for.</p><p>Local conditions are the other factor a generic buyer ignores. Around Las Vegas, the issues we see most are extreme-heat roof, stucco, and HVAC degradation, expansive caliche soils cracking slabs, and aging polybutylene plumbing in 1990s homes. We've made offers on homes with every one of those problems, so none of it scares us off or kills the deal at the last minute.</p><p>We buy across the whole area \u2014 from close-in neighborhoods like the Historic Westside out to Henderson and North Las Vegas \u2014 and in Nevada the local economy anchored by tourism and gaming on the Strip, warehousing, and a fast-growing tech and health sector keeps demand real. Inherited homes, tired rentals, pre-foreclosure situations in Clark County, and houses that simply need more work than the owner wants to take on: those are the Las Vegas sellers we help most.</p><p>Being a genuinely local buyer near the Strip also means our offer isn't a lowball pulled from a national algorithm that has never seen Las Vegas. We know what a block in the Historic Westside, east Las Vegas, Spring Valley, and Sunrise Manor actually sells for, what the Las Vegas Valley buyers will and won't pay for, and how Clark County's title and closing process really works. That local read is why our sellers get a number they can trust and a closing that actually happens on the date we promised.</p>",
  "situations": [
    {
      "title": "Inherited a house in Las Vegas",
      "body": "Settling an estate \u2014 often from out of state \u2014 is hard enough without a listing on top of it. We buy inherited Las Vegas homes as-is, work alongside the Clark County probate process, and let you take what matters and leave the rest."
    },
    {
      "title": "Tired of two mortgages",
      "body": "If you've already moved and the old Las Vegas place is just draining you every month, we can take it off your hands quickly."
    },
    {
      "title": "Divorce or a major life change",
      "body": "When the goal is simply to have the Las Vegas house handled cleanly and split fairly, we make the sale the simple part."
    },
    {
      "title": "Downsizing or aging in place",
      "body": "When a longtime the Historic Westside-area home has become too much to keep up, we make a fair offer and let you set a move-out date that isn't rushed."
    },
    {
      "title": "Relocating",
      "body": "A job change shouldn't mean carrying two mortgages or managing a sale from a thousand miles away. Close on your schedule and move on."
    },
    {
      "title": "Facing foreclosure",
      "body": "If you're behind on payments in Clark County, a fast cash sale can settle the loan before it hits your credit. We move on your timeline, not the bank's."
    }
  ],
  "testimonials": [
    {
      "quote": "Inherited my mom's place in the Historic Westside and couldn't face fixing it up. They closed in nine days and I never had to fly back out.",
      "who": "Angela K., Las Vegas"
    },
    {
      "quote": "Had a written offer already and they beat it. Straightforward, and the number they promised was the number at closing.",
      "who": "Deborah M., North Las Vegas"
    },
    {
      "quote": "Facing foreclosure and out of time. They moved fast, let me pick the date, and I walked away with cash in hand.",
      "who": "Rebecca S., Las Vegas"
    }
  ],
  "faq": [
    {
      "q": "How fast can you close on my Las Vegas house?",
      "a": "As little as 7 days through a licensed Nevada title company, or any later date you choose. Sellers in Las Vegas pick the timeline that fits their move."
    },
    {
      "q": "Do I pay any fees or commissions?",
      "a": "None. No agent commissions, no listing fees, and we cover standard closing costs. The number we agree on is what you receive."
    },
    {
      "q": "Do I need to repair or clean the house first?",
      "a": "No. We buy Las Vegas homes in any condition \u2014 including the extreme-heat roof we see so often here. Take what you want and leave the rest."
    },
    {
      "q": "How do you decide the offer amount?",
      "a": "We look at recent comparable sales in your Las Vegas neighborhood \u2014 places like the Historic Westside \u2014 the home's condition, and current the Las Vegas Valley demand, then make a fair cash offer you're free to accept or decline."
    },
    {
      "q": "Is this a licensed, legitimate way to sell in Nevada?",
      "a": "Yes. We are a direct buyer, not your agent or broker, and we put that in writing. Nevada permits direct purchases when acting on your own behalf; we buy as a principal, not as your agent."
    },
    {
      "q": "Can you help with foreclosure, probate, or tenants?",
      "a": "Often, yes. We regularly work with Clark County sellers facing foreclosure, probate, liens, or tenant issues, and we structure the sale around the situation."
    }
  ]
}