{
  "city": "New York City",
  "city_slug": "new-york-city",
  "metro": "the five boroughs",
  "phone": "(509) 355-7455",
  "phone_raw": "15093557455",
  "review_count": 52,
  "median_price": "$780,000",
  "avg_dom": 58,
  "cash_share": "38%",
  "neighborhoods": "the Bronx's Wakefield, Brooklyn's East New York, Queens's Jamaica, Staten Island's Mariners Harbor, and Canarsie",
  "landmark": "the Manhattan skyline",
  "outlying_area": "Yonkers and Long Island",
  "local_market_longform": "<p>New York City is its own market, and a cash sale here works differently than the national talking points suggest. Homes in New York City currently trade around a median of $780,000 and take roughly 58 days to go under contract, with about 38% of area sales closing in cash. When you need certainty instead of a drawn-out listing \u2014 a firm number and a date you choose \u2014 that local pace is exactly why selling directly makes sense.</p><p>The housing stock shapes everything about condition here. New York City runs heavily to 1900s\u20131930s brick rowhomes, brownstones, and two-families across the outer boroughs, plus post-war attached homes, and each era carries its own repair realities. That matters because we price the house in front of us rather than asking you to renovate it first \u2014 the things a traditional buyer's inspector flags are the same things we already expect and account for.</p><p>Local conditions are the other factor a generic buyer ignores. Around New York City, the issues we see most are aging rowhome and brownstone plumbing and knob-and-tube wiring, flat-roof and parapet failures, coastal and Sandy-zone flood risk, and lead-paint in older stock. We've made offers on homes with every one of those problems, so none of it scares us off or kills the deal at the last minute.</p><p>We buy across the whole area \u2014 from close-in neighborhoods like the Bronx's Wakefield out to Yonkers and Long Island \u2014 and in New York the local economy anchored by finance, healthcare, real estate, and the world's densest service economy keeps demand real. Inherited homes, tired rentals, pre-foreclosure situations in Kings, Queens, Bronx, and Richmond, and houses that simply need more work than the owner wants to take on: those are the New York City sellers we help most.</p><p>Being a genuinely local buyer near the Manhattan skyline also means our offer isn't a lowball pulled from a national algorithm that has never seen New York City. We know what a block in the Bronx's Wakefield, Brooklyn's East New York, Queens's Jamaica, and Staten Island's Mariners Harbor actually sells for, what the five boroughs buyers will and won't pay for, and how Kings, Queens, Bronx, and Richmond's title and closing process really works. That local read is why our sellers get a number they can trust and a closing that actually happens on the date we promised.</p>",
  "situations": [
    {
      "title": "Tired of two mortgages",
      "body": "If you've already moved and the old New York City place is just draining you every month, we can take it off your hands quickly."
    },
    {
      "title": "Facing foreclosure",
      "body": "If you're behind on payments in Kings, Queens, Bronx, and Richmond, a fast cash sale can settle the loan before it hits your credit. We move on your timeline, not the bank's."
    },
    {
      "title": "Downsizing or aging in place",
      "body": "When a longtime the Bronx's Wakefield-area home has become too much to keep up, we make a fair offer and let you set a move-out date that isn't rushed."
    },
    {
      "title": "Divorce or a major life change",
      "body": "When the goal is simply to have the New York City house handled cleanly and split fairly, we make the sale the simple part."
    },
    {
      "title": "Relocating",
      "body": "A job change shouldn't mean carrying two mortgages or managing a sale from a thousand miles away. Close on your schedule and move on."
    },
    {
      "title": "Inherited a house in New York City",
      "body": "Settling an estate \u2014 often from out of state \u2014 is hard enough without a listing on top of it. We buy inherited New York City homes as-is, work alongside the Kings, Queens, Bronx, and Richmond probate process, and let you take what matters and leave the rest."
    }
  ],
  "testimonials": [
    {
      "quote": "Inherited my mom's place in Canarsie and couldn't face fixing it up. They closed in nine days and I never had to fly back out.",
      "who": "Frank J., New York City"
    },
    {
      "quote": "Had a written offer already and they beat it. Straightforward, and the number they promised was the number at closing.",
      "who": "Sharon S., Long Island"
    },
    {
      "quote": "Facing foreclosure and out of time. They moved fast, let me pick the date, and I walked away with cash in hand.",
      "who": "Nicole H., New York City"
    }
  ],
  "faq": [
    {
      "q": "How fast can you close on my New York City house?",
      "a": "As little as 7 days through a licensed New York title company, or any later date you choose. Sellers in New York City pick the timeline that fits their move."
    },
    {
      "q": "Do I pay any fees or commissions?",
      "a": "None. No agent commissions, no listing fees, and we cover standard closing costs. The number we agree on is what you receive."
    },
    {
      "q": "Do I need to repair or clean the house first?",
      "a": "No. We buy New York City homes in any condition \u2014 including the aging rowhome and brownstone plumbing and knob-and-tube wiring we see so often here. Take what you want and leave the rest."
    },
    {
      "q": "How do you decide the offer amount?",
      "a": "We look at recent comparable sales in your New York City neighborhood \u2014 places like the Bronx's Wakefield \u2014 the home's condition, and current the five boroughs demand, then make a fair cash offer you're free to accept or decline."
    },
    {
      "q": "Is this a licensed, legitimate way to sell in New York?",
      "a": "Yes. We are a direct buyer, not your agent or broker, and we put that in writing. New York permits direct purchases; we market our own equitable interest to a private buyer network and disclose our role in writing."
    },
    {
      "q": "Can you help with foreclosure, probate, or tenants?",
      "a": "Often, yes. We regularly work with Kings, Queens, Bronx, and Richmond sellers facing foreclosure, probate, liens, or tenant issues, and we structure the sale around the situation."
    }
  ]
}